1. Повторить все действия по доработке БД vk из урока.

Результат повторения действий из урока:

Field	Type	Null	Key	Default	Extra
id	bigint unsigned	NO	PRI	NULL	auto_increment
firstname	varchar(150)	NO		NULL	
lastname	varchar(150)	NO		NULL	
email	varchar(150)	NO	UNI	NULL	
phone	char(11)	NO	UNI	NULL	
password_hash	char(80)	YES		NULL	
created_at	datetime	NO		CURRENT_TIMESTAMP	DEFAULT_GENERATED
id	firstname	lastname	email	phone	password_hash	created_at
1	Alex	Stepanov	alex@mail.com	89213546566	aaa	2021-06-10 01:54:57
13	Lena	Stepanova	lena@mail.com	89213546568	ghjgjhg	2020-01-01 00:00:00
45	Jane	Night	jane_n@mail.com	89293946560	NULL	2021-06-10 01:54:57
55	Jane	Kvanov	jane@mail.com	89293546560	NULL	2021-06-10 01:54:57
56	Igor	Petrov	igor@mail.com	89213549560	NULL	2021-06-10 01:54:57
57	Oksana	Petrova	oksana@mail.com	89213549561	NULL	2021-06-10 01:54:57
58	Iren	Sidorova	iren@mail.com	89213541560	NULL	2021-06-10 01:54:57
1+4
5
Hello!
Hello!
NOW()
2021-06-10 01:55:42
id	firstname	lastname	email	phone	password_hash	created_at
1	Alex	Stepanov	alex@mail.com	89213546566	aaa	2021-06-10 01:54:57
13	Lena	Stepanova	lena@mail.com	89213546568	ghjgjhg	2020-01-01 00:00:00
45	Jane	Night	jane_n@mail.com	89293946560	NULL	2021-06-10 01:54:57
55	Jane	Kvanov	jane@mail.com	89293546560	NULL	2021-06-10 01:54:57
56	Igor	Petrov	igor@mail.com	89213549560	NULL	2021-06-10 01:54:57
57	Oksana	Petrova	oksana@mail.com	89213549561	NULL	2021-06-10 01:54:57
58	Iren	Sidorova	iren@mail.com	89213541560	NULL	2021-06-10 01:54:57
lastname	firstname
Stepanov	Alex
Stepanova	Lena
Night	Jane
Kvanov	Jane
Petrov	Igor
Petrova	Oksana
Sidorova	Iren
firstname	lastname
Alex	Stepanov
Lena	Stepanova
Jane	Night
Jane	Kvanov
Igor	Petrov
Oksana	Petrova
Iren	Sidorova
id	firstname	lastname	email	phone	password_hash	created_at
1	Alex	Stepanov	alex@mail.com	89213546566	aaa	2021-06-10 01:54:57
13	Lena	Stepanova	lena@mail.com	89213546568	ghjgjhg	2020-01-01 00:00:00
id	firstname	lastname	email	phone	password_hash	created_at
1	Alex	Stepanov	alex@mail.com	89213546566	aaa	2021-06-10 01:54:57
id	firstname	lastname	email	phone	password_hash	created_at
1	Alex	Stepanov	alex@mail.com	89213546566	aaa	2021-06-10 01:54:57
id	firstname	lastname	email	phone	password_hash	created_at
1	Alex	Stepanov	alex@mail.com	89213546566	aaa	2021-06-10 01:54:57
58	Iren	Sidorova	iren@mail.com	89213541560	NULL	2021-06-10 01:54:57
id	firstname	lastname	email	phone	password_hash	created_at
1	Alex	Stepanov	alex@mail.com	89213546566	aaa	2021-06-10 01:54:57
58	Iren	Sidorova	iren@mail.com	89213541560	NULL	2021-06-10 01:54:57
id	firstname	lastname	email	phone	password_hash	created_at
1	Alex	Stepanov	alex@mail.com	89213546566	aaa	2021-06-10 01:54:57
13	Lena	Stepanova	lena@mail.com	89213546568	ghjgjhg	2020-01-01 00:00:00
45	Jane	Night	jane_n@mail.com	89293946560	NULL	2021-06-10 01:54:57
55	Jane	Kvanov	jane@mail.com	89293546560	NULL	2021-06-10 01:54:57
56	Igor	Petrov	igor@mail.com	89213549560	NULL	2021-06-10 01:54:57
57	Oksana	Petrova	oksana@mail.com	89213549561	NULL	2021-06-10 01:54:57
58	Iren	Sidorova	iren@mail.com	89213541560	NULL	2021-06-10 01:54:57
id	firstname	lastname	email	phone	password_hash	created_at
1	Alex	Stepanov	alex@mail.com	89213546566	aaa	2021-06-10 01:54:57
13	Lena	Stepanova	lena@mail.com	89213546568	ghjgjhg	2020-01-01 00:00:00
45	Jane	Night	jane_n@mail.com	89293946560	NULL	2021-06-10 01:54:57
55	Jane	Kvanov	jane@mail.com	89293546560	NULL	2021-06-10 01:54:57
56	Igor	Petrov	igor@mail.com	89213549560	NULL	2021-06-10 01:54:57
57	Oksana	Petrova	oksana@mail.com	89213549561	NULL	2021-06-10 01:54:57
58	Iren	Sidorova	iren@mail.com	89213541560	NULL	2021-06-10 01:54:57
id	firstname	lastname	email	phone	password_hash	created_at
1	Alex	Stepanov	alex@mail.com	89213546566	aaa	2021-06-10 01:54:57
13	Lena	Stepanova	lena@mail.com	89213546568	ghjgjhg	2020-01-01 00:00:00
45	Jane	Night	jane_n@mail.com	89293946560	NULL	2021-06-10 01:54:57
55	Jane	Kvanov	jane@mail.com	89293546560	NULL	2021-06-10 01:54:57
56	Igor	Petrov	igor@mail.com	89213549560	NULL	2021-06-10 01:54:57
57	Oksana	Petrova	oksana@mail.com	89213549561	NULL	2021-06-10 01:54:57
58	Iren	Sidorova	iren@mail.com	89213541560	NULL	2021-06-10 01:54:57
name
Alex Stepanov
Lena Stepanova
Jane Night
Jane Kvanov
Igor Petrov
Oksana Petrova
Iren Sidorova
name
A. Stepanov
L. Stepanova
J. Night
J. Kvanov
I. Petrov
O. Petrova
I. Sidorova
id	firstname	lastname	email	phone	password_hash	created_at
1	Alex	Stepanov	alex@mail.com	89213546566	aaa	2021-06-10 01:54:57
13	Lena	Stepanova	lena@mail.com	89213546568	ghjgjhg	2020-01-01 00:00:00
id	firstname	lastname	email	phone	password_hash	created_at
1	Alex	Stepanov	alex@mail.com	89213546566	aaa	2021-06-10 01:54:57
13	Lena	Stepanova	lena@mail.com	89213546568	ghjgjhg	2020-01-01 00:00:00
45	Jane	Night	jane_n@mail.com	89293946560	NULL	2021-06-10 01:54:57
55	Jane	Kvanov	jane@mail.com	89293546560	NULL	2021-06-10 01:54:57
56	Igor	Petrov	igor@mail.com	89213549560	NULL	2021-06-10 01:54:57
57	Oksana	Petrova	oksana@mail.com	89213549561	NULL	2021-06-10 01:54:57
58	Iren	Sidorova	iren@mail.com	89213541560	NULL	2021-06-10 01:54:57
id	firstname	lastname	email	phone	password_hash	created_at
57	Oksana	Petrova	oksana@mail.com	89213549561	NULL	2021-06-10 01:54:57
58	Iren	Sidorova	iren@mail.com	89213541560	NULL	2021-06-10 01:54:57
id	firstname	lastname	email	phone	password_hash	created_at
57	Oksana	Petrova	oksana@mail.com	89213549561	NULL	2021-06-10 01:54:57
58	Iren	Sidorova	iren@mail.com	89213541560	NULL	2021-06-10 01:54:57
id	firstname	lastname	email	phone	password_hash	created_at
1	Alex	Stepanov	alex@mail.com	89213546566	aaa	2021-06-10 01:54:57
13	Lena	Stepanova	lena@mail.com	89213546568	ghjgjhg	2020-01-01 00:00:00
45	Jane	Night	jane_n@mail.com	89293946560	NULL	2021-06-10 01:54:57
55	Jane	Kvanov	jane@mail.com	89293546560	NULL	2021-06-10 01:54:57
56	Igor	Petrov	igor@mail.com	89213549560	NULL	2021-06-10 01:54:57
57	Oksana	Petrova	oksana@mail.com	89213549561	NULL	2021-06-10 01:54:57
58	Iren	Sidorova	iren@mail.com	89213541560	NULL	2021-06-10 01:54:57


2. Используя сервис http://filldb.info , https://www.mockaroo.com/ или другой по вашему желанию, сгенерировать тестовые данные для всех таблиц, используя vk-data.sql,
 учитывая логику связей. Для всех таблиц, где это имеет смысл, создать не менее 100 строк. Для media_types создать ровно 4 строки. Загрузить тестовые данные. 
Приложить к отчёту полученный дамп с данными.

mysql> create database vk2;
Query OK, 1 row affected (0.02 sec)

mysql> exit
Bye

C:\Users\roman>mysql vk2 < "fulldb10-06-2021 06-21.sql"

C:\Users\roman>mysql vk2
Welcome to the MySQL monitor.  Commands end with ; or \g.
Your MySQL connection id is 42
Server version: 8.0.24 MySQL Community Server - GPL

Copyright (c) 2000, 2021, Oracle and/or its affiliates.

Oracle is a registered trademark of Oracle Corporation and/or its
affiliates. Other names may be trademarks of their respective
owners.

Type 'help;' or '\h' for help. Type '\c' to clear the current input statement.

mysql> show tables;
+-------------------+
| Tables_in_vk2     |
+-------------------+
| communities       |
| communities_users |
| friend_requests   |
| media             |
| media_types       |
| messages          |
| profiles          |
| users             |
+-------------------+
8 rows in set (0.01 sec)

3. Написать запрос для переименования названий типов медиа (колонка name в media_types), которые вы получили в пункте 3 в image, audio, video, document. Написать запрос, удаляющий заявки в друзья самому себе.

mysql> select * from media_types;
+----+-------+
| id | name  |
+----+-------+
|  2 | dicta |
|  3 | eaque |
|  1 | odit  |
|  4 | ut    |
+----+-------+
4 rows in set (0.03 sec)

mysql> update media_types
    -> set name = 'image' where id=1;
Query OK, 1 row affected (0.01 sec)
Rows matched: 1  Changed: 1  Warnings: 0

mysql> update media_types set name = 'audio' where id=2;
Query OK, 1 row affected (0.01 sec)
Rows matched: 1  Changed: 1  Warnings: 0

mysql> update media_types set name = 'video' where id=3;
Query OK, 1 row affected (0.01 sec)
Rows matched: 1  Changed: 1  Warnings: 0

mysql> update media_types set name = 'document' where id=4;
Query OK, 1 row affected (0.01 sec)
Rows matched: 1  Changed: 1  Warnings: 0

mysql> select * from media_types;
+----+----------+
| id | name     |
+----+----------+
|  2 | audio    |
|  4 | document |
|  1 | image    |
|  3 | video    |
+----+----------+
4 rows in set (0.00 sec)



mysql> delete from friend_requests where from_user_id=to_user_id;
Query OK, 0 rows affected (0.01 sec)


4. Написать название темы курсового проекта
База данных банка